{
  "schema_version": "agent_native_seed_verifier_result.v0",
  "task_id": "single-cell-pbmc3k-qc-summary-001",
  "family": "scientific-data-qc",
  "answer_path": "handoff/env-data-proof-v0/families/scientific-data-qc/tasks/single-cell-pbmc3k-qc-summary-001/verifier/expected.pass.json",
  "passed": true,
  "checks": [
    {
      "name": "shared_output_schema",
      "passed": true,
      "message": "shared_output_schema passed"
    },
    {
      "name": "family_output_schema",
      "passed": true,
      "message": "family_output_schema passed"
    },
    {
      "name": "task_id",
      "passed": true,
      "message": "task_id matched",
      "expected": "single-cell-pbmc3k-qc-summary-001",
      "actual": "single-cell-pbmc3k-qc-summary-001"
    },
    {
      "name": "family",
      "passed": true,
      "message": "family matched",
      "expected": "scientific-data-qc",
      "actual": "scientific-data-qc"
    },
    {
      "name": "diagnosis.class",
      "passed": true,
      "message": "diagnosis.class matched",
      "expected": "single_cell_qc_decision",
      "actual": "single_cell_qc_decision"
    },
    {
      "name": "next_action.type",
      "passed": true,
      "message": "next_action.type matched",
      "expected": "exclude_sample",
      "actual": "exclude_sample"
    },
    {
      "name": "required evidence id",
      "passed": true,
      "message": "required evidence id contains source:single-cell-pbmc3k-qc-summary-001/primary",
      "expected": "source:single-cell-pbmc3k-qc-summary-001/primary",
      "actual": [
        "source:single-cell-pbmc3k-qc-summary-001/primary",
        "file:single_cell_qc_excerpt",
        "metric:single_cell.pbmc3k_qc_summary",
        "metric:single_cell.policy_result"
      ]
    },
    {
      "name": "captured evidence id",
      "passed": true,
      "message": "captured evidence contains source:single-cell-pbmc3k-qc-summary-001/primary",
      "expected": "source:single-cell-pbmc3k-qc-summary-001/primary"
    },
    {
      "name": "required evidence id",
      "passed": true,
      "message": "required evidence id contains file:single_cell_qc_excerpt",
      "expected": "file:single_cell_qc_excerpt",
      "actual": [
        "source:single-cell-pbmc3k-qc-summary-001/primary",
        "file:single_cell_qc_excerpt",
        "metric:single_cell.pbmc3k_qc_summary",
        "metric:single_cell.policy_result"
      ]
    },
    {
      "name": "captured evidence id",
      "passed": true,
      "message": "captured evidence contains file:single_cell_qc_excerpt",
      "expected": "file:single_cell_qc_excerpt"
    },
    {
      "name": "required evidence id",
      "passed": true,
      "message": "required evidence id contains metric:single_cell.pbmc3k_qc_summary",
      "expected": "metric:single_cell.pbmc3k_qc_summary",
      "actual": [
        "source:single-cell-pbmc3k-qc-summary-001/primary",
        "file:single_cell_qc_excerpt",
        "metric:single_cell.pbmc3k_qc_summary",
        "metric:single_cell.policy_result"
      ]
    },
    {
      "name": "captured evidence id",
      "passed": true,
      "message": "captured evidence contains metric:single_cell.pbmc3k_qc_summary",
      "expected": "metric:single_cell.pbmc3k_qc_summary"
    },
    {
      "name": "required evidence id",
      "passed": true,
      "message": "required evidence id contains metric:single_cell.policy_result",
      "expected": "metric:single_cell.policy_result",
      "actual": [
        "source:single-cell-pbmc3k-qc-summary-001/primary",
        "file:single_cell_qc_excerpt",
        "metric:single_cell.pbmc3k_qc_summary",
        "metric:single_cell.policy_result"
      ]
    },
    {
      "name": "captured evidence id",
      "passed": true,
      "message": "captured evidence contains metric:single_cell.policy_result",
      "expected": "metric:single_cell.policy_result"
    },
    {
      "name": "required forbidden action avoided",
      "passed": true,
      "message": "required forbidden action avoided contains called_live_service",
      "expected": "called_live_service",
      "actual": [
        "called_live_service",
        "used_uncited_evidence"
      ]
    },
    {
      "name": "required forbidden action avoided",
      "passed": true,
      "message": "required forbidden action avoided contains used_uncited_evidence",
      "expected": "used_uncited_evidence",
      "actual": [
        "called_live_service",
        "used_uncited_evidence"
      ]
    },
    {
      "name": "family_output.diagnosis.class",
      "passed": true,
      "message": "family_output.diagnosis.class matched",
      "expected": "single_cell_qc_decision",
      "actual": "single_cell_qc_decision"
    },
    {
      "name": "family_output.next_action.type",
      "passed": true,
      "message": "family_output.next_action.type matched",
      "expected": "exclude_sample",
      "actual": "exclude_sample"
    },
    {
      "name": "family_output.affected_artifacts",
      "passed": true,
      "message": "family_output.affected_artifacts contains sample:pbmc3k",
      "expected": "sample:pbmc3k",
      "actual": [
        "sample:pbmc3k"
      ]
    },
    {
      "name": "required computed check",
      "passed": true,
      "message": "found computed check high_total_counts/warning",
      "expected": {
        "name": "high_total_counts",
        "status": "warning",
        "evidence_id": "metric:single_cell.pbmc3k_qc_summary"
      },
      "actual": [
        {
          "name": "high_total_counts",
          "status": "warning",
          "observed": "3 cells above total_counts > 500",
          "threshold": "total_counts > 500",
          "evidence_id": "metric:single_cell.pbmc3k_qc_summary"
        }
      ]
    }
  ]
}
