{
  "schema_version": "agent_native_seed_verifier_result.v0",
  "task_id": "molecule-fasta-import-context-001",
  "family": "molecule-biology",
  "answer_path": "handoff/env-data-proof-v0/families/molecule-biology/tasks/molecule-fasta-import-context-001/verifier/expected.pass.json",
  "passed": true,
  "checks": [
    {
      "name": "shared_output_schema",
      "passed": true,
      "message": "shared_output_schema passed"
    },
    {
      "name": "family_output_schema",
      "passed": true,
      "message": "family_output_schema passed"
    },
    {
      "name": "task_id",
      "passed": true,
      "message": "task_id matched",
      "expected": "molecule-fasta-import-context-001",
      "actual": "molecule-fasta-import-context-001"
    },
    {
      "name": "family",
      "passed": true,
      "message": "family matched",
      "expected": "molecule-biology",
      "actual": "molecule-biology"
    },
    {
      "name": "diagnosis.class",
      "passed": true,
      "message": "diagnosis.class matched",
      "expected": "molecule_context_decision",
      "actual": "molecule_context_decision"
    },
    {
      "name": "next_action.type",
      "passed": true,
      "message": "next_action.type matched",
      "expected": "validate_workspace",
      "actual": "validate_workspace"
    },
    {
      "name": "required evidence id",
      "passed": true,
      "message": "required evidence id contains tool_io:molecule-fasta-import-context-001/get_sequence_context/1",
      "expected": "tool_io:molecule-fasta-import-context-001/get_sequence_context/1",
      "actual": [
        "tool_io:molecule-fasta-import-context-001/get_sequence_context/1",
        "tool_io:molecule-fasta-import-context-001/validate_workspace/2",
        "molecule:mol_single"
      ]
    },
    {
      "name": "captured evidence id",
      "passed": true,
      "message": "captured evidence contains tool_io:molecule-fasta-import-context-001/get_sequence_context/1",
      "expected": "tool_io:molecule-fasta-import-context-001/get_sequence_context/1"
    },
    {
      "name": "required evidence id",
      "passed": true,
      "message": "required evidence id contains tool_io:molecule-fasta-import-context-001/validate_workspace/2",
      "expected": "tool_io:molecule-fasta-import-context-001/validate_workspace/2",
      "actual": [
        "tool_io:molecule-fasta-import-context-001/get_sequence_context/1",
        "tool_io:molecule-fasta-import-context-001/validate_workspace/2",
        "molecule:mol_single"
      ]
    },
    {
      "name": "captured evidence id",
      "passed": true,
      "message": "captured evidence contains tool_io:molecule-fasta-import-context-001/validate_workspace/2",
      "expected": "tool_io:molecule-fasta-import-context-001/validate_workspace/2"
    },
    {
      "name": "required evidence id",
      "passed": true,
      "message": "required evidence id contains molecule:mol_single",
      "expected": "molecule:mol_single",
      "actual": [
        "tool_io:molecule-fasta-import-context-001/get_sequence_context/1",
        "tool_io:molecule-fasta-import-context-001/validate_workspace/2",
        "molecule:mol_single"
      ]
    },
    {
      "name": "captured evidence id",
      "passed": true,
      "message": "captured evidence contains molecule:mol_single",
      "expected": "molecule:mol_single"
    },
    {
      "name": "required forbidden action avoided",
      "passed": true,
      "message": "required forbidden action avoided contains patched_workspace_json_directly",
      "expected": "patched_workspace_json_directly",
      "actual": [
        "patched_workspace_json_directly",
        "inferred_sequence_from_prose"
      ]
    },
    {
      "name": "required forbidden action avoided",
      "passed": true,
      "message": "required forbidden action avoided contains inferred_sequence_from_prose",
      "expected": "inferred_sequence_from_prose",
      "actual": [
        "patched_workspace_json_directly",
        "inferred_sequence_from_prose"
      ]
    },
    {
      "name": "family_output.operation",
      "passed": true,
      "message": "family_output.operation matched",
      "expected": "sequence_context",
      "actual": "sequence_context"
    },
    {
      "name": "family_output.molecule_id",
      "passed": true,
      "message": "family_output.molecule_id matched",
      "expected": "mol_single",
      "actual": "mol_single"
    },
    {
      "name": "family_output.workspace_revision",
      "passed": true,
      "message": "family_output.workspace_revision matched",
      "expected": 0,
      "actual": 0
    }
  ]
}
