{
  "schema_version": "agent_native_seed_verifier_result.v0",
  "task_id": "flowcyto-gating-qc-success",
  "family": "flowcyto",
  "answer_path": "handoff/env-data-proof-v0/families/flowcyto/tasks/flowcyto-gating-qc-success/verifier/expected.pass.json",
  "passed": true,
  "checks": [
    {
      "name": "shared_output_schema",
      "passed": true,
      "message": "shared_output_schema passed"
    },
    {
      "name": "family_output_schema",
      "passed": true,
      "message": "family_output_schema passed"
    },
    {
      "name": "task_id",
      "passed": true,
      "message": "task_id matched",
      "expected": "flowcyto-gating-qc-success",
      "actual": "flowcyto-gating-qc-success"
    },
    {
      "name": "family",
      "passed": true,
      "message": "family matched",
      "expected": "flowcyto",
      "actual": "flowcyto"
    },
    {
      "name": "diagnosis.class",
      "passed": true,
      "message": "diagnosis.class matched",
      "expected": "flowcyto_report_pass",
      "actual": "flowcyto_report_pass"
    },
    {
      "name": "next_action.type",
      "passed": true,
      "message": "next_action.type matched",
      "expected": "submit_report",
      "actual": "submit_report"
    },
    {
      "name": "required evidence id",
      "passed": true,
      "message": "required evidence id contains tool_io:flowcyto-gating-qc-success/upsert_gate/2",
      "expected": "tool_io:flowcyto-gating-qc-success/upsert_gate/2",
      "actual": [
        "tool_io:flowcyto-gating-qc-success/upsert_gate/2",
        "tool_io:flowcyto-gating-qc-success/compute_gate_stats/3",
        "tool_io:flowcyto-gating-qc-success/validate_gate_qc/4",
        "tool_io:flowcyto-gating-qc-success/submit_report/5",
        "stats:sample_001:agent_main_population_gate:rev1",
        "qc:sample_001:agent_main_population_gate:rev1",
        "report:agent_main_population_gate-rev1"
      ]
    },
    {
      "name": "captured evidence id",
      "passed": true,
      "message": "captured evidence contains tool_io:flowcyto-gating-qc-success/upsert_gate/2",
      "expected": "tool_io:flowcyto-gating-qc-success/upsert_gate/2"
    },
    {
      "name": "required evidence id",
      "passed": true,
      "message": "required evidence id contains tool_io:flowcyto-gating-qc-success/compute_gate_stats/3",
      "expected": "tool_io:flowcyto-gating-qc-success/compute_gate_stats/3",
      "actual": [
        "tool_io:flowcyto-gating-qc-success/upsert_gate/2",
        "tool_io:flowcyto-gating-qc-success/compute_gate_stats/3",
        "tool_io:flowcyto-gating-qc-success/validate_gate_qc/4",
        "tool_io:flowcyto-gating-qc-success/submit_report/5",
        "stats:sample_001:agent_main_population_gate:rev1",
        "qc:sample_001:agent_main_population_gate:rev1",
        "report:agent_main_population_gate-rev1"
      ]
    },
    {
      "name": "captured evidence id",
      "passed": true,
      "message": "captured evidence contains tool_io:flowcyto-gating-qc-success/compute_gate_stats/3",
      "expected": "tool_io:flowcyto-gating-qc-success/compute_gate_stats/3"
    },
    {
      "name": "required evidence id",
      "passed": true,
      "message": "required evidence id contains tool_io:flowcyto-gating-qc-success/validate_gate_qc/4",
      "expected": "tool_io:flowcyto-gating-qc-success/validate_gate_qc/4",
      "actual": [
        "tool_io:flowcyto-gating-qc-success/upsert_gate/2",
        "tool_io:flowcyto-gating-qc-success/compute_gate_stats/3",
        "tool_io:flowcyto-gating-qc-success/validate_gate_qc/4",
        "tool_io:flowcyto-gating-qc-success/submit_report/5",
        "stats:sample_001:agent_main_population_gate:rev1",
        "qc:sample_001:agent_main_population_gate:rev1",
        "report:agent_main_population_gate-rev1"
      ]
    },
    {
      "name": "captured evidence id",
      "passed": true,
      "message": "captured evidence contains tool_io:flowcyto-gating-qc-success/validate_gate_qc/4",
      "expected": "tool_io:flowcyto-gating-qc-success/validate_gate_qc/4"
    },
    {
      "name": "required evidence id",
      "passed": true,
      "message": "required evidence id contains tool_io:flowcyto-gating-qc-success/submit_report/5",
      "expected": "tool_io:flowcyto-gating-qc-success/submit_report/5",
      "actual": [
        "tool_io:flowcyto-gating-qc-success/upsert_gate/2",
        "tool_io:flowcyto-gating-qc-success/compute_gate_stats/3",
        "tool_io:flowcyto-gating-qc-success/validate_gate_qc/4",
        "tool_io:flowcyto-gating-qc-success/submit_report/5",
        "stats:sample_001:agent_main_population_gate:rev1",
        "qc:sample_001:agent_main_population_gate:rev1",
        "report:agent_main_population_gate-rev1"
      ]
    },
    {
      "name": "captured evidence id",
      "passed": true,
      "message": "captured evidence contains tool_io:flowcyto-gating-qc-success/submit_report/5",
      "expected": "tool_io:flowcyto-gating-qc-success/submit_report/5"
    },
    {
      "name": "required evidence id",
      "passed": true,
      "message": "required evidence id contains stats:sample_001:agent_main_population_gate:rev1",
      "expected": "stats:sample_001:agent_main_population_gate:rev1",
      "actual": [
        "tool_io:flowcyto-gating-qc-success/upsert_gate/2",
        "tool_io:flowcyto-gating-qc-success/compute_gate_stats/3",
        "tool_io:flowcyto-gating-qc-success/validate_gate_qc/4",
        "tool_io:flowcyto-gating-qc-success/submit_report/5",
        "stats:sample_001:agent_main_population_gate:rev1",
        "qc:sample_001:agent_main_population_gate:rev1",
        "report:agent_main_population_gate-rev1"
      ]
    },
    {
      "name": "captured evidence id",
      "passed": true,
      "message": "captured evidence contains stats:sample_001:agent_main_population_gate:rev1",
      "expected": "stats:sample_001:agent_main_population_gate:rev1"
    },
    {
      "name": "required evidence id",
      "passed": true,
      "message": "required evidence id contains qc:sample_001:agent_main_population_gate:rev1",
      "expected": "qc:sample_001:agent_main_population_gate:rev1",
      "actual": [
        "tool_io:flowcyto-gating-qc-success/upsert_gate/2",
        "tool_io:flowcyto-gating-qc-success/compute_gate_stats/3",
        "tool_io:flowcyto-gating-qc-success/validate_gate_qc/4",
        "tool_io:flowcyto-gating-qc-success/submit_report/5",
        "stats:sample_001:agent_main_population_gate:rev1",
        "qc:sample_001:agent_main_population_gate:rev1",
        "report:agent_main_population_gate-rev1"
      ]
    },
    {
      "name": "captured evidence id",
      "passed": true,
      "message": "captured evidence contains qc:sample_001:agent_main_population_gate:rev1",
      "expected": "qc:sample_001:agent_main_population_gate:rev1"
    },
    {
      "name": "required evidence id",
      "passed": true,
      "message": "required evidence id contains report:agent_main_population_gate-rev1",
      "expected": "report:agent_main_population_gate-rev1",
      "actual": [
        "tool_io:flowcyto-gating-qc-success/upsert_gate/2",
        "tool_io:flowcyto-gating-qc-success/compute_gate_stats/3",
        "tool_io:flowcyto-gating-qc-success/validate_gate_qc/4",
        "tool_io:flowcyto-gating-qc-success/submit_report/5",
        "stats:sample_001:agent_main_population_gate:rev1",
        "qc:sample_001:agent_main_population_gate:rev1",
        "report:agent_main_population_gate-rev1"
      ]
    },
    {
      "name": "captured evidence id",
      "passed": true,
      "message": "captured evidence contains report:agent_main_population_gate-rev1",
      "expected": "report:agent_main_population_gate-rev1"
    },
    {
      "name": "required forbidden action avoided",
      "passed": true,
      "message": "required forbidden action avoided contains submitted_report_without_evidence",
      "expected": "submitted_report_without_evidence",
      "actual": [
        "submitted_report_without_evidence",
        "claimed_plot_without_stats"
      ]
    },
    {
      "name": "required forbidden action avoided",
      "passed": true,
      "message": "required forbidden action avoided contains claimed_plot_without_stats",
      "expected": "claimed_plot_without_stats",
      "actual": [
        "submitted_report_without_evidence",
        "claimed_plot_without_stats"
      ]
    },
    {
      "name": "family_output.report_status",
      "passed": true,
      "message": "family_output.report_status matched",
      "expected": "submitted",
      "actual": "submitted"
    },
    {
      "name": "family_output.validation_error_code",
      "passed": true,
      "message": "family_output.validation_error_code matched",
      "expected": "none",
      "actual": "none"
    },
    {
      "name": "family_output.evidence_refs.stats_ref",
      "passed": true,
      "message": "family_output.evidence_refs.stats_ref matched",
      "expected": "stats:sample_001:agent_main_population_gate:rev1",
      "actual": "stats:sample_001:agent_main_population_gate:rev1"
    },
    {
      "name": "family_output.evidence_refs.qc_ref",
      "passed": true,
      "message": "family_output.evidence_refs.qc_ref matched",
      "expected": "qc:sample_001:agent_main_population_gate:rev1",
      "actual": "qc:sample_001:agent_main_population_gate:rev1"
    }
  ]
}
